{
  "$schema": "../../schemas/script_contract.schema.json",
  "format": "IC10_SCRIPT_CONTRACT_V1",
  "source": "ic10/live-commissioning/stack_cell_monitor_v1_0.ic10",
  "source_sha256": "b771adc664d7fa3c41de1ce851163581756766a3402368c5e055f0fe3ad3d93d",
  "identity": {
    "service_id": "ic10.script.stack.cell.monitor",
    "implementation_revision": "1.0",
    "deployment_family": "live-commissioning",
    "deployment_class": "on-demand",
    "layer": "On-demand commissioning",
    "purpose": "Read-only target IC stack-cell monitor with a Logic Memory address selector and visible value mirror."
  },
  "device_ports": [
    {
      "port": "d0",
      "role": "d0",
      "aliases": [],
      "requirement": "required",
      "device_properties": {
        "reads": [
          "PrefabHash",
          "ReferenceId"
        ],
        "writes": [],
        "slot_reads": [],
        "slot_writes": []
      },
      "stack": {
        "literal_reads": [],
        "literal_writes": [],
        "dynamic_read": true,
        "dynamic_write": false,
        "dynamic_read_ranges": [
          {
            "start": 0,
            "end": 511
          }
        ],
        "dynamic_write_ranges": [],
        "dynamic_read_range_source": "source-fingerprinted-exception",
        "dynamic_write_range_source": "none",
        "constraints": []
      },
      "target": {
        "kind": "stack-interface",
        "verification": "access-only",
        "interface_id": "ic10.interface.access.6cc2b046c4ebd492",
        "definition_ref": "contracts/index.json#/interfaces/ic10.interface.access.6cc2b046c4ebd492",
        "provider_resolution": "deployment-supplied",
        "assumptions": {
          "properties_read": [
            "PrefabHash",
            "ReferenceId"
          ],
          "properties_written": [],
          "slot_properties_read": [],
          "slot_properties_written": []
        }
      }
    },
    {
      "port": "d1",
      "role": "d1",
      "aliases": [],
      "requirement": "required",
      "device_properties": {
        "reads": [
          "Setting"
        ],
        "writes": [],
        "slot_reads": [],
        "slot_writes": []
      },
      "stack": {
        "literal_reads": [],
        "literal_writes": [],
        "dynamic_read": false,
        "dynamic_write": false,
        "dynamic_read_ranges": [],
        "dynamic_write_ranges": [],
        "dynamic_read_range_source": "none",
        "dynamic_write_range_source": "none",
        "constraints": []
      },
      "target": {
        "kind": "physical-device",
        "verification": "device-properties",
        "assumptions": {
          "properties_read": [
            "Setting"
          ],
          "properties_written": [],
          "slot_properties_read": [],
          "slot_properties_written": []
        }
      }
    },
    {
      "port": "d2",
      "role": "d2",
      "aliases": [],
      "requirement": "optional",
      "device_properties": {
        "reads": [
          "Setting"
        ],
        "writes": [
          "Setting"
        ],
        "slot_reads": [],
        "slot_writes": []
      },
      "stack": {
        "literal_reads": [],
        "literal_writes": [],
        "dynamic_read": false,
        "dynamic_write": false,
        "dynamic_read_ranges": [],
        "dynamic_write_ranges": [],
        "dynamic_read_range_source": "none",
        "dynamic_write_range_source": "none",
        "constraints": []
      },
      "target": {
        "kind": "physical-device",
        "verification": "device-properties",
        "assumptions": {
          "properties_read": [
            "Setting"
          ],
          "properties_written": [
            "Setting"
          ],
          "slot_properties_read": [],
          "slot_properties_written": []
        }
      }
    }
  ],
  "network_dependencies": [],
  "own_stack": {
    "size": 512,
    "literal_reads": [
      6
    ],
    "literal_writes": [
      0,
      1,
      2,
      3,
      4,
      5,
      6
    ],
    "dynamic_read": false,
    "dynamic_write": false,
    "dynamic_read_ranges": [],
    "dynamic_write_ranges": [],
    "dynamic_range_source": "none",
    "clears_all": false,
    "external_readable_ranges": [],
    "external_writable_ranges": [],
    "fields": [
      {
        "address": 0,
        "name": "Header@S0.Magic",
        "value_type": "hash",
        "semantic_source": "protocol-header",
        "access": [
          "self-write"
        ],
        "const": 31416052
      },
      {
        "address": 1,
        "name": "Header@S0.ABI",
        "value_type": "integer",
        "semantic_source": "protocol-header",
        "access": [
          "self-write"
        ],
        "const": 1
      },
      {
        "address": 2,
        "name": "S2",
        "value_type": "number",
        "semantic_source": "unresolved",
        "access": [
          "self-write"
        ]
      },
      {
        "address": 3,
        "name": "S3",
        "value_type": "number",
        "semantic_source": "unresolved",
        "access": [
          "self-write"
        ]
      },
      {
        "address": 4,
        "name": "S4",
        "value_type": "number",
        "semantic_source": "unresolved",
        "access": [
          "self-write"
        ]
      },
      {
        "address": 5,
        "name": "S5",
        "value_type": "number",
        "semantic_source": "unresolved",
        "access": [
          "self-write"
        ]
      },
      {
        "address": 6,
        "name": "CompleteSampleGenerationPublishes",
        "value_type": "integer",
        "semantic_source": "source",
        "access": [
          "self-read",
          "self-write"
        ],
        "description": "complete sample generation publishes LAST"
      }
    ],
    "headers": [
      {
        "base": 0,
        "magic": 31416052,
        "abi": 1
      }
    ]
  },
  "behavior": {
    "publication_rules": [
      {
        "kind": "commit-last",
        "address": 6,
        "description": "complete sample generation publishes LAST",
        "source": "verified-inline-order"
      }
    ],
    "restart": {
      "mode": "preserved-unless-overwritten",
      "source": "static-entry-path-analysis"
    },
    "invariants": [
      {
        "id": "header.s0.magic",
        "kind": "cell-equals",
        "address": 0,
        "equals": 31416052,
        "source": "generated-protocol-header"
      },
      {
        "id": "header.s0.abi",
        "kind": "cell-equals",
        "address": 1,
        "equals": 1,
        "source": "generated-protocol-header"
      }
    ]
  },
  "contracts": {
    "provides": [
      {
        "protocol_id": "ic10.stack.31416052.abi1",
        "base": 0,
        "magic": 31416052,
        "abi": 1,
        "source": "literal-own-stack-header"
      }
    ],
    "consumes": []
  },
  "extraction": {
    "mode": "static-v1",
    "limitations": [
      "Dynamic addresses are flagged but cannot be assigned literal ranges.",
      "Dynamic bounds that require control-flow reasoning are source-fingerprinted overrides.",
      "Provided and consumed protocols require authoritative declarations verified against source literals.",
      "Field semantics not represented by source comments or literals remain in supplemental canonical data."
    ]
  }
}
